<?xml version="1.0" encoding="UTF-8"?>
<movie id="mov003" xmlns:xsi="http://www.w3.org/2001/XMLSchema-instance"
       xsi:noNamespaceSchemaLocation="../../schemas/movie_schema.xsd">
    <title>Parasite</title>
    <year>2019</year>
    <director>Bong Joon Ho</director>
    <genres>
        <genre>Thriller</genre>
        <genre>Comedy</genre>
        <genre>Drama</genre>
    </genres>
    <actors>
        <actor>Song Kang-ho</actor>
        <actor>Lee Sun-kyun</actor>
        <actor>Cho Yeo-jeong</actor>
    </actors>
    <plot><![CDATA[Greed and class discrimination threaten the newly formed symbiotic relationship between the wealthy Park family and the destitute Kim clan.]]></plot>
    <posterUrl>https://m.media-amazon.com/images/M/MV5BYWZjMjk3ZTItODQ2ZC00NTY5LWE0ZDYtZTI3MjcwN2Q5NTVkXkEyXkFqcGdeQXVyODk4OTc3MTY@._V1_SX300.jpg</posterUrl>
    <rating>8.5</rating>
</movie>