<?xml version="1.0" encoding="UTF-8"?>
<movie id="mov002" xmlns:xsi="http://www.w3.org/2001/XMLSchema-instance"
       xsi:noNamespaceSchemaLocation="../../schemas/movie_schema.xsd">
    <title>Interstellar</title>
    <year>2014</year>
    <director>Christopher Nolan</director>
    <genres>
        <genre>Sci-Fi</genre>
        <genre>Drama</genre>
        <genre>Adventure</genre>
    </genres>
    <actors>
        <actor>Matthew McConaughey</actor>
        <actor>Anne Hathaway</actor>
        <actor>Jessica Chastain</actor>
    </actors>
    <plot><![CDATA[A team of explorers travel through a wormhole in space in an attempt to ensure humanity's survival.]]></plot>
    <posterUrl>https://m.media-amazon.com/images/M/MV5BZjdkOTU3MDktN2IxOS00OGEyLWFmMjktY2FiMmZkNWIyODZiXkEyXkFqcGdeQXVyMTMxODk2OTU@._V1_SX300.jpg</posterUrl>
    <rating>8.7</rating>
</movie>